{
  "author_identity": "brian@benthic.io",
  "author_pubkey": "qwG8vQQN7m/uB0Nwgor3s1EJCKjqZM/SNThV+V7XumM=",
  "collection_name": "ngopen",
  "created_at": "2026-08-11T15:14:04Z",
  "cryptographic_signature": {
    "algorithm": "EdDSA",
    "canonicalization": "RFC8785",
    "hash_algorithm": "SHA-256",
    "payload_hash": "38db11227c87e0879980cc28ced678675b3b79576e30c47365ffff36f4147ca5",
    "signature_base64": "xZfLdID5Y2f5Y05YvW9B+7ECdq2KNNS+Bh1xyUVQc8ibxhK6QCQkPqHAKe249INDAaQybmJdH9vQ0mIleFMGDQ==",
    "signed_at": "2026-09-30T23:45:51Z"
  },
  "description": "Five federal open-data APIs published by benthic.io as a single connected collection, served over PostgREST from PostgreSQL/PostGIS.",
  "join_paths": [
    {
      "from": {
        "column": "uei",
        "dataset_name": "usaspending",
        "relation": "all_entities"
      },
      "join_type": "identifier",
      "notes": "DUNS-to-UEI transition: use uei_crosswalk for pre-2022 identifiers",
      "reliability": "reliable",
      "to": {
        "column": "uei",
        "dataset_name": "samer",
        "relation": "sam_registrations"
      }
    },
    {
      "from": {
        "column": "duns",
        "dataset_name": "usaspending",
        "relation": "all_entities"
      },
      "join_type": "heuristic",
      "reliability": "heuristic",
      "to": {
        "column": "ein",
        "dataset_name": "irs_ng",
        "relation": "bmf_organizations"
      }
    },
    {
      "from": {
        "column": "duns",
        "dataset_name": "samer",
        "relation": "sam_registrations"
      },
      "join_type": "heuristic",
      "reliability": "heuristic",
      "to": {
        "column": "ein",
        "dataset_name": "irs_ng",
        "relation": "bmf_organizations"
      }
    },
    {
      "from": {
        "column": "geom_point",
        "dataset_name": "usaspending",
        "relation": "all_entities",
        "srid": 4326
      },
      "join_type": "spatial",
      "notes": "ST_Transform required; rpc_find_district and rpc_nonprofits_in_district do it internally",
      "reliability": "reliable",
      "to": {
        "column": "geom",
        "dataset_name": "up_cdmaps",
        "relation": "congressional_districts",
        "srid": 3857
      }
    },
    {
      "from": {
        "column": "geom_point",
        "dataset_name": "usp_cl",
        "relation": "district_offices"
      },
      "join_type": "spatial",
      "notes": "Office locations may sit outside the district they serve",
      "reliability": "partial",
      "to": {
        "column": "geom",
        "dataset_name": "up_cdmaps",
        "relation": "congressional_districts"
      }
    },
    {
      "from": {
        "column": "congressional_district",
        "dataset_name": "usaspending",
        "relation": "all_entities"
      },
      "join_type": "identifier",
      "notes": "Must pair with state; bracket action_date by congress_start/end",
      "reliability": "partial",
      "to": {
        "column": "district",
        "dataset_name": "usp_cl",
        "relation": "legislator_terms"
      }
    }
  ],
  "license": "CC0",
  "members": [
    {
      "dataset_name": "usaspending",
      "manifest_url": "https://benthic.io/bdp/ngopen/usaspending/manifest.json",
      "payload_hash": "21c31fef16b227e38e061c5f61e88ede440d120da879938197922e94e41fe1ba",
      "title": "USAspending Federal Awards"
    },
    {
      "dataset_name": "irs_ng",
      "manifest_url": "https://benthic.io/bdp/ngopen/irs_ng/manifest.json",
      "payload_hash": "fd4788608caf292b34c2c2872b8eb52cf2bb16998eb881e8392271c9b005fc79",
      "title": "IRS Nonprofit Organizations"
    },
    {
      "dataset_name": "samer",
      "manifest_url": "https://benthic.io/bdp/ngopen/samer/manifest.json",
      "payload_hash": "cf45dc61829a9e481ffca77bb54a0d684fbf30f66ef6c8ddc8e3ccd37dd31a53",
      "title": "SAM.gov Entity Registrations"
    },
    {
      "dataset_name": "up_cdmaps",
      "manifest_url": "https://benthic.io/bdp/ngopen/up_cdmaps/manifest.json",
      "payload_hash": "7b151ec81114ae04ea260406465480b114eba7eedec364287c1020e830baca58",
      "title": "Historical Congressional District Boundaries"
    },
    {
      "dataset_name": "usp_cl",
      "manifest_url": "https://benthic.io/bdp/ngopen/usp_cl/manifest.json",
      "payload_hash": "d13a6b57ef9190480ba253d56fcff8652d345770a4fe0526cbd0305c756f6c8a",
      "title": "United States Congress Legislators"
    }
  ],
  "protocol_version": "1.0.0",
  "purpose": "NGOpen exists to make federal spending traceable across the boundaries government publishes it behind: awards at USAspending, entities at SAM.gov, nonprofits at IRS, districts by census cycle, legislators catalogued separately. Each is public. None join. The collection exists to join them, and is intended to grow, admitting APIs only when they extend traceability of public money.",
  "title": "NGOpen"
}
