{
  "author_identity": "brian@benthic.io",
  "author_pubkey": "qwG8vQQN7m/uB0Nwgor3s1EJCKjqZM/SNThV+V7XumM=",
  "collection_name": "parts",
  "created_at": "2026-09-24T15:50:00Z",
  "cryptographic_signature": {
    "algorithm": "EdDSA",
    "canonicalization": "RFC8785",
    "hash_algorithm": "SHA-256",
    "payload_hash": "fed5e465711f63ce4046f18b9b352ed999c1860d402960a62f60864dee5c8a8c",
    "signature_base64": "wGF/ijh+fre5I93ecDC+DTNE1sVjV30RwdEDwe+7zK3vWkR/f3TWYi58lPSiDUo1VyGDMCQDHNcUkjqhATPHDQ==",
    "signed_at": "2026-09-24T22:33:03Z"
  },
  "description": "Vehicle, component, and identifier reference datasets published by benthic.io using signed BDP manifests and PostgREST APIs.",
  "join_paths": [],
  "license": "Varies by member; see each dataset manifest.",
  "members": [
    {
      "dataset_name": "nhtsa",
      "manifest_url": "https://benthic.io/bdp/parts/nhtsa/manifest.json",
      "payload_hash": "483c611966e76e5ccf502268ff3d2397884b82dfabc6bc650718479618870ac7",
      "title": "NHTSA vPIC Vehicle Information"
    }
  ],
  "protocol_version": "1.0.0",
  "purpose": "Parts provides a growing collection of vehicle and component datasets for identifying parts, vehicles, manufacturers, and technical reference data. The NHTSA vPIC dataset is the first member and combines the official decoder with a synchronized reference layer.",
  "title": "Parts"
}
